{
  "fixture_id": "comparison-001",
  "model_version": "CogA-1.0-pro",
  "contract_version": "1.0",
  "reasoning_pack_id": "default",
  "reasoning_pack_version": "1.0",
  "profile_id": null,
  "profile_version": null,
  "device": null,
  "scenario_type": "comparison",
  "expected_outcome": "COMPLETE"
}
